{
  "schema_version": "1.0.0",
  "id": "vision.ruler-ticks",
  "name_zh": "实物尺刻线候选",
  "name_en": "Physical Ruler Tick Candidates",
  "category": "processor",
  "maturity": "incubating",
  "implementation_status": "adapter-present",
  "version": "0.1.0",
  "input_kinds": [
    "frame-packet.image-frame",
    "frame-packet.camera-frame",
    "frame-packet.screen-frame"
  ],
  "output_kinds": [
    "sensor-event.measurement"
  ],
  "capabilities": [
    "rgba-pixel-input",
    "source-frame-provenance",
    "fixed-source-compatible",
    "unconfirmed-ruler-tick-candidates"
  ],
  "source_references": [
    {
      "repository": "https://github.com/WUHAO19831214/webcam-laser-fringelab",
      "commit": "37a8b3996791790a22980b0d562996a65a3a65ef",
      "paths": [
        "lib/ruler-detection.ts",
        "lib/ruler.worker.ts",
        "lib/ruler-ocr.ts"
      ],
      "notes": "Owner-authorized extraction; algorithm preserved, source application unchanged."
    }
  ],
  "evidence_level": "source-tested",
  "license_review": "approved",
  "known_boundaries": [
    "Millimetre tick model; possible period ambiguity; OCR/scale require human confirmation. One-dimensional calibration is not homography."
  ],
  "owners": [
    "WUHAO19831214"
  ]
}
