{
  "schema_version": "1.0.0",
  "id": "screen.capture",
  "name_zh": "屏幕采集传感器",
  "name_en": "Screen Capture Sensor",
  "category": "source",
  "maturity": "incubating",
  "implementation_status": "adapter-present",
  "version": "0.3.0",
  "input_kinds": [],
  "output_kinds": ["frame-packet.screen-frame"],
  "capabilities": ["browser-get-display-media", "recorded-screen-replay", "stream-end-detection", "frame-timestamps", "requested-vs-measured-sampling-rate", "runtime-rgba-pixels"],
  "source_references": [
    {
      "repository": "https://github.com/WUHAO19831214/physics-experiment-bridge-mvp",
      "commit": "8bba87df6475cae1e595fc925551db8bea83fb68",
      "paths": ["src/screen/ScreenCapturePanel.tsx", "src/screen/screenCaptureRuntime.ts", "docs/SCREEN_CAPTURE_PIPELINE.md"],
      "notes": "User-authorized browser screen/window capture feeding ROI processing."
    },
    {
      "repository": "https://github.com/WUHAO19831214/ampere-force-visualizer-teacher-yanan",
      "commit": "cb073e89d6d87129287030f1df08bd540504eb39",
      "paths": ["src/screen/ScreenCapturePanel.tsx", "docs/SENSOR_INTEGRATION.md"],
      "notes": "Teacher workflow confirms that screen OCR is a pixel bridge, not direct DIS SDK access."
    }
  ],
  "evidence_level": "replay-benchmarked",
  "license_review": "pending",
  "known_boundaries": ["A user must explicitly choose a screen, window, or tab; construction and configuration do not request permission.", "Page reload normally requires permission again, and denial/end are capture lifecycle errors rather than device failures.", "The source exposes user-authorized pixels, not device SDK or internal application data; OCR remains downstream."],
  "owners": ["WUHAO19831214"]
}
